{
  "$schema": "../../schema/bosses.schema.json",
  "_doc": "17 §1.2 and §2-9 — the eight campaign bosses and the FTUE mini-boss, authored as DSL data. 17 §11: 'All 8 bosses expressed purely in the effect DSL — zero bespoke boss code.' Every script is a BossScript the boss encounter builder consumes: an id, 17 §1.2's four coefficients, the script's own effect set, and exactly three phase blocks whose mechanics NAME those effects by id. 🔒 An effect is EMBEDDED here rather than referenced across files — there is no effect registry — so a mechanic's effectId and a RANDOM_OUTCOME row alike name a SIBLING declared by this same script. The embedded effect objects are validated against schema/effect.schema.json by a cross-file content rule, because this schema may neither $ref it (same-document pointers only) nor restate its op vocabulary. ⚠️ The three engine built-ins SYS_ENRAGE, SYS_PHASE3_IMMUNE_STUN and SYS_PHASE3_IMMUNE_FREEZE are attached to every boss by the encounter builder and are deliberately NOT authored here; a script that named one is refused (A3). 🔒 maxAlive is the standing add count the boss's OWN section states, not 17 §1's 3 everywhere: §1's 'capped at 3 alive at once' is a CEILING the builder enforces (A5), and a summon authored at 3 tops the field up to 3 whatever the fight says. §2 writes '(max 3 alive)' in so many words and §6 states no standing count at all, so Thornmaw and Rimehold carry 3; §4's 'summons 2 skeletons ... resummons any dead ones', §7's 'summons 2 WARDEN drones' and §8's 'summons 2 sporelings ... resummons 1' each put TWO adds on the field and never authorise a third, so those carry 2.",
  "_status": "transcribed",

  "secondaryStats": {
    "_doc": "17 §1.2 — 'every boss uses the baseline'. Authored once rather than repeated on nine rows, and handed to the encounter builder as the row whose four power coefficients each script then replaces. 17 §1.2 is explicit that anything else — Gulgrot's 30% lifesteal, the Dicelord's every-6th auto-crit — 'is a phase mechanic in the fight scripts below, never a base stat, so the pre-battle power readout stays honest'. The remaining baseline entries 17 §1.2 lists (BLOCK, PEN, DMG%/DR%/THORN 0, HEAL% 1.0) are not enemy statline members and are deliberately absent rather than authored as zeroes nothing reads.",
    "crit": 0.05,
    "critDamage": 0.5,
    "dodge": 0.0,
    "lifesteal": 0.0
  },

  "scripts": [
    {
      "id": "BOSS_THORNMAW",
      "chapter": 1,
      "_doc": "17 §2 — the teaching boss. Phase 1 carries NO mechanics: 17 §2 is 'basic attacks only, ASPD 0.7. Nothing else', and 17 §1.2 states that the 0.7 is this row's aspd coefficient and 'not a phase aura'. 17 §2's failure mode to avoid — 'Root stacking with itself. It must refresh, not stack' — is the NONE + refreshOnReapply stacking on the Root, which is 18 §6's BLEED idiom.",
      "coefficients": { "hp": 2.4, "atk": 0.8, "def": 0.8, "aspd": 0.7 },
      "addsPowerFraction": 0.3,
      "effects": [
        {
          "id": "BOSS_THORNMAW_P2_ROOT",
          "op": "STAT_ADD_PCT",
          "stat": "ASPD",
          "value": -0.4,
          "trigger": { "kind": "PERIODIC", "interval": 8.0 },
          "target": "ALL_ENEMIES",
          "duration": { "seconds": 3.0, "scope": "BATTLE" },
          "stacking": { "mode": "NONE", "refreshOnReapply": true }
        },
        {
          "id": "BOSS_THORNMAW_P3_BLOOM",
          "op": "SUMMON",
          "archetype": "SWARM",
          "value": 2,
          "maxAlive": 3,
          "trigger": { "kind": "ON_PHASE_ENTER", "phase": 3 }
        },
        {
          "id": "BOSS_THORNMAW_P3_REGROWTH",
          "op": "SUMMON",
          "archetype": "SWARM",
          "value": 2,
          "maxAlive": 3,
          "trigger": { "kind": "PERIODIC", "interval": 12.0 }
        },
        {
          "id": "BOSS_THORNMAW_P3_RAGE",
          "op": "APPLY_STATUS",
          "statusId": "RAGE",
          "value": 0.3,
          "trigger": { "kind": "ON_PHASE_ENTER", "phase": 3 },
          "target": "SELF",
          "duration": { "scope": "PHASE" }
        }
      ],
      "phases": [
        { "phase": 1, "mechanics": [] },
        { "phase": 2, "mechanics": [{ "effectId": "BOSS_THORNMAW_P2_ROOT", "telegraphSeconds": 1.2 }] },
        {
          "phase": 3,
          "mechanics": [
            { "effectId": "BOSS_THORNMAW_P3_BLOOM" },
            { "effectId": "BOSS_THORNMAW_P3_REGROWTH" },
            { "effectId": "BOSS_THORNMAW_P3_RAGE" }
          ]
        }
      ]
    },

    {
      "id": "BOSS_GULGROT",
      "chapter": 2,
      "_doc": "17 §3 — sustain check. 🔒 The 30% lifesteal is a phase-3 mechanic and not a base stat, exactly as 17 §1.2 requires. ⚠️ 'Applies 2 POISON stacks' is authored as TWO sibling effects: the DSL carries a per-application potency and duration (18 §1/§6) and no stack COUNT key, so N stacks is N applications — 18 §7.4's PK_UNBREAKABLE and §9.1's CP_GLASS_HEART are the precedent for one design being two effects. The 1.2 s wind-up 17 §3 authors sits on the first of the pair only, so the pair emits one telegraph for one green cloud. ⚠️ Croak's on-hit POISON is named in phase 1 ONLY, and Cindermaw's on-hit BURN — the identical shape — is named in all three. The difference is not an oversight: a phase entry deactivates the block being left, and 17 §5's phase 2 'refreshes all BURN stacks', which is meaningless with nothing still applying them. 17 §3's phases 2 and 3 carry their own poison sources (Belch, Spit) and depend on no phase-1 applier, so Croak ends with Croak, exactly as the section reads.",
      "coefficients": { "hp": 2.5, "atk": 0.85, "def": 0.7, "aspd": 0.75 },
      "effects": [
        {
          "id": "BOSS_GULGROT_P1_CROAK_POISON",
          "op": "APPLY_STATUS",
          "statusId": "POISON",
          "value": 0.02,
          "trigger": { "kind": "ON_HIT" },
          "target": "CURRENT_TARGET",
          "duration": { "seconds": 4.0, "scope": "BATTLE" },
          "stacking": { "mode": "ADDITIVE", "maxStacks": 3, "refreshOnReapply": true }
        },
        {
          "id": "BOSS_GULGROT_P2_BOG_AIR",
          "op": "STAT_ADD_PCT",
          "stat": "HEAL_PCT",
          "value": -0.35,
          "trigger": { "kind": "ON_PHASE_ENTER", "phase": 2 },
          "target": "ALL_ENEMIES",
          "duration": { "scope": "PHASE" }
        },
        {
          "id": "BOSS_GULGROT_P2_BELCH_FIRST",
          "op": "APPLY_STATUS",
          "statusId": "POISON",
          "value": 0.02,
          "trigger": { "kind": "PERIODIC", "interval": 10.0 },
          "target": "ALL_ENEMIES",
          "duration": { "seconds": 4.0, "scope": "BATTLE" },
          "stacking": { "mode": "ADDITIVE", "maxStacks": 3, "refreshOnReapply": true }
        },
        {
          "id": "BOSS_GULGROT_P2_BELCH_SECOND",
          "op": "APPLY_STATUS",
          "statusId": "POISON",
          "value": 0.02,
          "trigger": { "kind": "PERIODIC", "interval": 10.0 },
          "target": "ALL_ENEMIES",
          "duration": { "seconds": 4.0, "scope": "BATTLE" },
          "stacking": { "mode": "ADDITIVE", "maxStacks": 3, "refreshOnReapply": true }
        },
        {
          "id": "BOSS_GULGROT_P3_GORGE_LIFESTEAL",
          "op": "STAT_ADD_PCT",
          "stat": "LIFESTEAL",
          "value": 0.3,
          "trigger": { "kind": "ON_PHASE_ENTER", "phase": 3 },
          "target": "SELF",
          "duration": { "scope": "PHASE" }
        },
        {
          "id": "BOSS_GULGROT_P3_SPIT",
          "op": "DAMAGE",
          "value": 1.2,
          "trigger": { "kind": "ON_HIT_TAKEN", "cooldown": 6.0 },
          "target": "CURRENT_TARGET"
        },
        {
          "id": "BOSS_GULGROT_P3_SPIT_POISON",
          "op": "APPLY_STATUS",
          "statusId": "POISON",
          "value": 0.02,
          "trigger": { "kind": "ON_HIT_TAKEN", "cooldown": 6.0 },
          "target": "CURRENT_TARGET",
          "duration": { "seconds": 4.0, "scope": "BATTLE" },
          "stacking": { "mode": "ADDITIVE", "maxStacks": 3, "refreshOnReapply": true }
        }
      ],
      "phases": [
        { "phase": 1, "mechanics": [{ "effectId": "BOSS_GULGROT_P1_CROAK_POISON" }] },
        {
          "phase": 2,
          "mechanics": [
            { "effectId": "BOSS_GULGROT_P2_BOG_AIR" },
            { "effectId": "BOSS_GULGROT_P2_BELCH_FIRST", "telegraphSeconds": 1.2 },
            { "effectId": "BOSS_GULGROT_P2_BELCH_SECOND" }
          ]
        },
        {
          "phase": 3,
          "mechanics": [
            { "effectId": "BOSS_GULGROT_P3_GORGE_LIFESTEAL" },
            { "effectId": "BOSS_GULGROT_P3_SPIT" },
            { "effectId": "BOSS_GULGROT_P3_SPIT_POISON" }
          ]
        }
      ]
    },

    {
      "id": "BOSS_OSSUARY_KING",
      "chapter": 3,
      "_doc": "17 §4 — burst windows. Rise Again is R9's ruling written out: 17 §1.1's ON_HP_THRESHOLD IS 18 §3's ON_LOW_HP, so the 1% trigger is {kind: ON_LOW_HP, threshold: 0.01, once: true} and there is no 24th trigger. It is authored as four effects on that one trigger because the DSL carries one op per effect and 17 §4 asks for four things at once — return to 25% HP, ATK +40%, ASPD +25%, and every add cleared. ⚠️ Ossify carries no wind-up: 17 §4 names a sound cue and no seconds, and SHIELD is not one of the three damaging ops, so T3 does not require one and none is invented.",
      "coefficients": { "hp": 2.1, "atk": 0.9, "def": 1.0, "aspd": 0.8 },
      "addsPowerFraction": 0.3,
      "effects": [
        {
          "id": "BOSS_OSSUARY_KING_P1_COURT",
          "op": "SUMMON",
          "archetype": "GRUNT",
          "value": 2,
          "maxAlive": 2,
          "trigger": { "kind": "ON_PHASE_ENTER", "phase": 1 }
        },
        {
          "id": "BOSS_OSSUARY_KING_P1_RECALL",
          "op": "SUMMON",
          "archetype": "GRUNT",
          "value": 2,
          "maxAlive": 2,
          "trigger": { "kind": "PERIODIC", "interval": 15.0 }
        },